{
  "schema": "hmx-vtcm-accounting-boundary-matrix/v1",
  "title": "R-A.1 conservative VTCM accounting boundary matrix",
  "contract": {
    "runtime_report_schema": 1,
    "identity_schema": 1,
    "event_scope_schema": 1,
    "event_scope_policy": "process-only-v1",
    "aggregate_scope": "process",
    "function_attribution": "declared-only",
    "allocation_site_attribution": "not-bound-in-v1",
    "resident_accounting_scope_binding": "not-proven",
    "address_alignment_in_report": "not-proven",
    "allocator_aligned_status": "not-proven",
    "header_accounting_status": "not-proven",
    "in_pool_header_absence": "source-verified-absent-out-of-band-size-host-metadata",
    "split_coalesce_model_status": "not-proven",
    "grid_attribution": "not-bound-in-v1",
    "cold_warm_runtime_status": "not-proven-runtime",
    "content_identity_status": "not-proven",
    "probe_default": "off",
    "backend_option": false,
    "v3_producer": false,
    "manifest_mutation": false,
    "launcher_mutation": false,
    "cache_envelope_mutation": false,
    "status_vocabulary": [
      "pass",
      "fail",
      "not-proven"
    ],
    "bounded_interval_status": "not-proven",
    "bounded_interval_basis": "resident-aligned-floor + transient-aligned-upper-bound + free-cache-cap"
  },
  "cells": [
    {
      "id": "gate.default_off",
      "axes": [
        "probe-gate"
      ],
      "status": "pass",
      "claim_scope": "source-contract",
      "claim": "The accounting state and report entry points exist only behind the build-time opt-in, whose CMake default is OFF.",
      "oracle": "gate_default_off",
      "limitations": [],
      "next_evidence": []
    },
    {
      "id": "identity.process_aggregate_only",
      "axes": [
        "identity-scope",
        "process-boundaries"
      ],
      "status": "not-proven",
      "claim_scope": "identity-join",
      "claim": "The v1 event context proves only a process aggregate with declared metadata: the runtime clears the per-event function and allocation-site ids, so the identity record carries declared context metadata rather than a per-event join. Function and site reach an event only through the separately versioned accounting-site-v1 declaration, which is a different record with its own scope.",
      "oracle": "process_aggregate_only",
      "limitations": [
        "The runtime clears function and allocation-site IDs on the v1 event context; the identity record is declared context metadata, not a per-event join.",
        "The additive accounting-site-v1 record does bind site token, function and site id to an event while it is registered, and a single-site transcript joins offline -- so this cell is about the process-aggregate record, not about the site declaration. The aggregate itself still publishes site_scope_status=not-bound-in-v1, which is what keeps it aggregate."
      ],
      "next_evidence": [
        "The single-site case is now computed offline over an attested capture (mode=diagnostic-only, observed_device=false, performance_claimed=false; exp/hmx/vtcm_accounting_probe/site_join.py). What is still missing before this identity cell can be more than aggregate-only is a multi-unit join: one observation process per function/module, or a versioned rule that lets a second function or site bind inside the same process.",
        "Do not infer attribution from the declared context: the aggregate record stays aggregate until such a rule exists."
      ]
    },
    {
      "id": "wire.no_v3_producer_or_backend_option",
      "axes": [
        "wire-boundary",
        "probe-gate"
      ],
      "status": "pass",
      "claim_scope": "source-contract",
      "claim": "The matrix contract declares no v3 producer and its host inputs expose no manifest, launcher, cache-envelope, or backend-option surface.",
      "oracle": "wire_boundary_unchanged",
      "limitations": [],
      "next_evidence": []
    },
    {
      "id": "probe.host_only_matrix",
      "axes": [
        "probe-gate",
        "wire-boundary"
      ],
      "status": "pass",
      "claim_scope": "source-contract",
      "claim": "The matrix command imports no device runner and contains no networking or subprocess execution path.",
      "oracle": "host_only_matrix",
      "limitations": [],
      "next_evidence": []
    },
    {
      "id": "ordinary.cold_warm_source_paths",
      "axes": [
        "cold-warm",
        "ordinary-resident",
        "free-cache"
      ],
      "status": "pass",
      "claim_scope": "source-contract",
      "claim": "The source has distinct first-allocation and same-footprint cache-hit paths and records ordinary alloc/free plus cache events.",
      "oracle": "ordinary_cold_warm_paths",
      "limitations": [],
      "next_evidence": []
    },
    {
      "id": "ordinary.device_cold_warm",
      "axes": [
        "cold-warm",
        "ordinary-resident",
        "free-cache"
      ],
      "status": "not-proven",
      "claim_scope": "device-observation",
      "claim": "A controlled cold process and warm same-process transition have not been imported as per-cell device evidence by this host matrix.",
      "oracle": "device_cold_warm_unproven",
      "limitations": [
        "The frozen host matrix does not ingest device phase records. A separate device-log overlay now parses cold/warm phases, but this cell remains not-proven because v1 has no cross-process identity/join rule."
      ],
      "next_evidence": [
        "Keep the device-log overlay separate from v1 and define an explicit process-pair join/reset protocol before promoting this observation."
      ]
    },
    {
      "id": "resident.source_lifetime_and_reuse",
      "axes": [
        "ordinary-resident",
        "cold-warm"
      ],
      "status": "pass",
      "claim_scope": "source-contract",
      "claim": "Ordinary buffers return to BufferManager/VtcmPool, while exact resident descriptors reuse one pinned block and resident free records retirement without releasing it.",
      "oracle": "resident_lifetime_paths",
      "limitations": [],
      "next_evidence": []
    },
    {
      "id": "resident.same_key_descriptor_conflict",
      "axes": [
        "ordinary-resident",
        "content-address-reuse"
      ],
      "status": "pass",
      "claim_scope": "source-contract",
      "claim": "A resident key collision with a different kind, byte count, alignment, or charged size fails before allocation and does not fall back or allocate a second block.",
      "oracle": "resident_descriptor_conflict",
      "limitations": [],
      "next_evidence": []
    },
    {
      "id": "resident.device_lifetime",
      "axes": [
        "ordinary-resident",
        "cold-warm"
      ],
      "status": "not-proven",
      "claim_scope": "device-observation",
      "claim": "A device matrix has not yet proved ordinary versus resident high-water and lifetime across cold and repeated launches.",
      "oracle": "resident_device_unproven",
      "limitations": [
        "The frozen host matrix does not ingest separate cold/repeated device snapshots. The device-log overlay observes resident counters, but v1 still has no cross-process resident identity or content proof."
      ],
      "next_evidence": [
        "Retain the separate cold/repeated logs and define a versioned process/resident identity contract before promoting the observation."
      ]
    },
    {
      "id": "alignment.supported_source_contract",
      "axes": [
        "alignment",
        "charged-units"
      ],
      "status": "pass",
      "claim_scope": "source-contract",
      "claim": "The ordinary and resident ABIs accept power-of-two alignment through 2048, so 128, 256, and 2048 are source-supported; invalid values fail closed.",
      "oracle": "alignment_source_contract",
      "limitations": [],
      "next_evidence": []
    },
    {
      "id": "alignment.device_addresses",
      "axes": [
        "alignment"
      ],
      "status": "not-proven",
      "claim_scope": "device-observation",
      "claim": "Actual device addresses for ordinary, weight-resident, and workspace-resident allocations at 128, 256, and 2048 are not established by this host/source result.",
      "oracle": "device_alignment_unproven",
      "limitations": [
        "Source alone still proves nothing about a device address: the runtime report keeps address_alignment_status=not-proven. The address-free overlay is the ingest point for the alignment_128/256/2048 phases, and it records only that each ordinary, weight-resident, and workspace-resident pointer satisfied the requested-alignment modulo \u2014 no address value, no address reuse, and no charged-bytes or alignment semantics."
      ],
      "next_evidence": [
        "Re-capture the three alignment phases whenever any of the four preflight fingerprint roles (probe_so, libtriton.so, linalg-hexagon-opt, libhmxapi.a) changes; physical address values, address reuse, and charged-bytes semantics stay not-proven."
      ]
    },
    {
      "id": "units.charged_bytes",
      "axes": [
        "charged-units",
        "alignment"
      ],
      "status": "pass",
      "claim_scope": "source-contract",
      "claim": "Charged bytes are allocator-rounded bytes: 128-byte quantum below 2048 and 2048-byte quantum at/above 2048, independent of a stricter address alignment.",
      "oracle": "charged_unit_contract",
      "limitations": [],
      "next_evidence": []
    },
    {
      "id": "cache.source_retain_hit_drop_evict",
      "axes": [
        "free-cache"
      ],
      "status": "pass",
      "claim_scope": "source-contract",
      "claim": "Retain, hit, drop, and allocation-failure eviction branches have explicit cumulative counters and bounded process events.",
      "oracle": "free_cache_source_paths",
      "limitations": [],
      "next_evidence": []
    },
    {
      "id": "cache.device_state_transitions",
      "axes": [
        "free-cache",
        "cold-warm"
      ],